metric_name,metric_type,interval,unit_name,per_unit_name,description,orientation,integration,short_name,curated_metric,sample_tags
logicinsight.pe.cluster_data_resiliency,gauge,15,,,Indicates the current level of data resiliency across the cluster,1,logicinsight_nutanix,cluster data resiliency,,
logicinsight.pe.cluster_lockdown,gauge,15,,,Shows whether the cluster is currently in lockdown mode restricting administrative access.,0,logicinsight_nutanix,cluster lockdown mode,,
logicinsight.pe.cluster_num_hosts,gauge,15,,,Number of physical hosts actively participating in the cluster.,1,logicinsight_nutanix,cluster number of hosts,,
logicinsight.pe.cluster_rf,gauge,15,,,Replication factor set for the cluster defining how many copies of data are stored.,1,logicinsight_nutanix,cluster resiliency factor,,
logicinsight.pe.cluster_global_status_critical,gauge,15,,,Number of active critical alerts affecting the overall cluster health.,-1,logicinsight_nutanix,cluster global status critical,,
logicinsight.pe.cluster_global_status_warning,gauge,15,,,Number of active warning-level alerts related to the cluster's global status.,-1,logicinsight_nutanix,cluster global status warning,,
logicinsight.pe.cluster_stats_avg_io_latency_usecs,gauge,15,,,Average I/O latency across all operations in the cluster measured in microseconds.,-1,logicinsight_nutanix,cluster stats avg io latency usecs,,
logicinsight.pe.cluster_stats_avg_read_io_latency_usecs,gauge,15,,,Average latency for read I/O operations across the cluster measured in microseconds.,-1,logicinsight_nutanix,cluster stats avg read io latency usecs,,
logicinsight.pe.cluster_stats_avg_write_io_latency_usecs,gauge,15,,,Average latency for write I/O operations across the cluster measured in microseconds.,-1,logicinsight_nutanix,cluster stats avg write io latency usecs,,
logicinsight.pe.cluster_stats_content_cache_hit_ppm,gauge,15,,,Percentage of hits in the content cache subsystem representing how often data is served from cache.,1,logicinsight_nutanix,cluster stats content cache hit,,
logicinsight.pe.cluster_stats_content_cache_logical_memory_usage_bytes,gauge,15,,,Logical memory consumed by the content cache measured in bytes.,1,logicinsight_nutanix,cluster stats content cache logical memory usage bytes,,
logicinsight.pe.cluster_stats_content_cache_logical_ssd_usage_bytes,gauge,15,,,Logical SSD space used by the content cache measured in bytes.,1,logicinsight_nutanix,cluster stats content cache logical ssd usage bytes,,
logicinsight.pe.cluster_stats_content_cache_num_dedup_ref_count_pph,gauge,15,,,Number of deduplicated references per hundred pages in the content cache.,1,logicinsight_nutanix,cluster stats content cache num dedup ref count page,,
logicinsight.pe.cluster_stats_content_cache_num_hits,gauge,15,,,Total number of hits registered in the content cache.,1,logicinsight_nutanix,cluster stats content cache num hits,,
logicinsight.pe.cluster_stats_content_cache_num_lookups,gauge,15,,,Total number of lookup attempts made by the content cache.,1,logicinsight_nutanix,cluster stats content cache num lookups,,
logicinsight.pe.cluster_stats_content_cache_physical_memory_usage_bytes,gauge,15,,,Physical memory consumed by the content cache measured in bytes.,1,logicinsight_nutanix,cluster stats content cache physical memory usage bytes,,
logicinsight.pe.cluster_stats_content_cache_physical_ssd_usage_bytes,gauge,15,,,Physical SSD space used by the content cache measured in bytes.,1,logicinsight_nutanix,cluster stats content cache physical ssd usage bytes,,
logicinsight.pe.cluster_stats_content_cache_saved_memory_usage_bytes,gauge,15,,,Amount of memory saved by the content cache through deduplication or compression.,1,logicinsight_nutanix,cluster stats content cache saved memory usage bytes,,
logicinsight.pe.cluster_stats_content_cache_saved_ssd_usage_bytes,gauge,15,,,SSD space saved in the content cache via deduplication or compression.,1,logicinsight_nutanix,cluster stats content cache saved ssd usage bytes,,
logicinsight.pe.cluster_stats_controller_avg_io_latency_usecs,gauge,15,,,Average I/O latency across all operations managed by the controller in microseconds.,-1,logicinsight_nutanix,cluster stats controller avg io latency usecs,,
logicinsight.pe.cluster_stats_controller_avg_read_io_latency_usecs,gauge,15,,,Average read I/O latency measured by the controller in microseconds.,-1,logicinsight_nutanix,cluster stats controller avg read io latency usecs,,
logicinsight.pe.cluster_stats_controller_avg_read_io_size_kbytes,gauge,15,,,Average size of read I/O operations handled by the controller in kibibytes.,1,logicinsight_nutanix,cluster stats controller avg read io size kbytes,,
logicinsight.pe.cluster_stats_controller_avg_write_io_latency_usecs,gauge,15,,,Average write I/O latency measured by the controller in microseconds.,-1,logicinsight_nutanix,cluster stats controller avg write io latency usecs,,
logicinsight.pe.cluster_stats_controller_avg_write_io_size_kbytes,gauge,15,,,Average size of write I/O operations handled by the controller in kibibytes.,1,logicinsight_nutanix,cluster stats controller avg write io size kbytes,,
logicinsight.pe.cluster_stats_controller_io_bandwidth_kBps,gauge,15,,,Total I/O bandwidth managed by the controller measured in kilobytes per second.,1,logicinsight_nutanix,cluster stats controller io bandwidth kBps,,
logicinsight.pe.cluster_stats_controller_num_io,gauge,15,,,Total number of I/O operations performed by the controller.,1,logicinsight_nutanix,cluster stats controller num io,,
logicinsight.pe.cluster_stats_controller_num_iops,gauge,15,,,Number of I/O operations per second (IOPS) measured at the controller level.,1,logicinsight_nutanix,cluster stats controller num iops,,
logicinsight.pe.cluster_stats_controller_num_random_io,gauge,15,,,Total number of random I/O operations handled by the controller.,1,logicinsight_nutanix,cluster stats controller num random io,,
logicinsight.pe.cluster_stats_controller_num_read_io,gauge,15,,,Total number of read I/O operations executed by the controller.,1,logicinsight_nutanix,cluster stats controller num read io,,
logicinsight.pe.cluster_stats_controller_num_read_iops,gauge,15,,,Number of read IOPS measured at the controller level.,1,logicinsight_nutanix,cluster stats controller num read iops,,
logicinsight.pe.cluster_stats_controller_num_seq_io,gauge,15,,,Total number of sequential I/O operations handled by the controller.,1,logicinsight_nutanix,cluster stats controller num seq io,,
logicinsight.pe.cluster_stats_controller_num_write_io,gauge,15,,,Total number of write I/O operations executed by the controller.,1,logicinsight_nutanix,cluster stats controller num write io,,
logicinsight.pe.cluster_stats_controller_num_write_iops,gauge,15,,,Number of write IOPS measured at the controller level.,1,logicinsight_nutanix,cluster stats controller num write iops,,
logicinsight.pe.cluster_stats_controller_random_io_ppm,gauge,15,,,Percentage of I/O operations that are random as measured by the controller.,1,logicinsight_nutanix,cluster stats controller random io ppm,,
logicinsight.pe.cluster_stats_controller_read_io_bandwidth_kBps,gauge,15,,,Bandwidth of read I/O operations handled by the controller in kilobytes per second.,1,logicinsight_nutanix,cluster stats controller read io bandwidth kBps,,
logicinsight.pe.cluster_stats_controller_read_io_ppm,gauge,15,,,Percentage of total I/O operations that are reads as measured by the controller.,1,logicinsight_nutanix,cluster stats controller read io ppm,,
logicinsight.pe.cluster_stats_controller_seq_io_ppm,gauge,15,,,Percentage of I/O operations that are sequential as seen by the controller.,1,logicinsight_nutanix,cluster stats controller seq io ppm,,
logicinsight.pe.cluster_stats_controller_timespan_usecs,gauge,15,,,Total time window over which controller I/O metrics were measured in microseconds.,1,logicinsight_nutanix,cluster stats controller timespan usecs,,
logicinsight.pe.cluster_stats_controller_total_io_size_kbytes,gauge,15,,,Total cumulative size of I/O operations processed by the controller in kibibytes.,1,logicinsight_nutanix,cluster stats controller total io size kbytes,,
logicinsight.pe.cluster_stats_controller_total_io_time_usecs,gauge,15,,,Total time spent processing all I/O operations at the controller in microseconds.,1,logicinsight_nutanix,cluster stats controller total io time usecs,,
logicinsight.pe.cluster_stats_controller_total_read_io_size_kbytes,gauge,15,,,Total size of read I/O operations processed by the controller in kibibytes.,1,logicinsight_nutanix,cluster stats controller total read io size kbytes,,
logicinsight.pe.cluster_stats_controller_total_read_io_time_usecs,gauge,15,,,Total time spent on read I/O operations at the controller in microseconds.,1,logicinsight_nutanix,cluster stats controller total read io time usecs,,
logicinsight.pe.cluster_stats_controller_total_transformed_usage_bytes,gauge,15,,,Amount of data transformed by the controller,1,logicinsight_nutanix,cluster stats controller total transformed usage bytes,,
logicinsight.pe.cluster_stats_controller_write_io_bandwidth_kBps,gauge,15,,,Bandwidth of write I/O operations handled by the controller in kilobytes per second.,1,logicinsight_nutanix,cluster stats controller write io bandwidth kBps,,
logicinsight.pe.cluster_stats_controller_write_io_ppm,gauge,15,,,Percentage of write I/O operations at the controller level.,1,logicinsight_nutanix,cluster stats controller write io ppm,,
logicinsight.pe.cluster_stats_hypervisor_avg_io_latency_usecs,gauge,15,,,Average I/O latency across all operations handled by the hypervisor in microseconds.,-1,logicinsight_nutanix,cluster stats hypervisor avg io latency usecs,,
logicinsight.pe.cluster_stats_hypervisor_avg_read_io_latency_usecs,gauge,15,,,Average latency of read I/O operations through the hypervisor in microseconds.,-1,logicinsight_nutanix,cluster stats hypervisor avg read io latency usecs,,
logicinsight.pe.cluster_stats_hypervisor_avg_write_io_latency_usecs,gauge,15,,,Average latency of write I/O operations through the hypervisor in microseconds.,-1,logicinsight_nutanix,cluster stats hypervisor avg write io latency usecs,,
logicinsight.pe.cluster_stats_hypervisor_cpu_usage_ppm,gauge,15,,,Total CPU usage across all hypervisors,-1,logicinsight_nutanix,cluster stats hypervisor cpu usage ppm,,
logicinsight.pe.cluster_stats_hypervisor_esx_cpu_usage_ppm,gauge,15,,,CPU usage specific to ESXi hypervisors,-1,logicinsight_nutanix,cluster stats hypervisor esx cpu usage ppm,,
logicinsight.pe.cluster_stats_hypervisor_esx_memory_usage_ppm,gauge,15,,,Memory usage specific to ESXi hypervisors,-1,logicinsight_nutanix,cluster stats hypervisor esx memory usage ppm,,
logicinsight.pe.cluster_stats_hypervisor_hyperv_cpu_usage_ppm,gauge,15,,,CPU usage specific to Hyper-V hypervisors,-1,logicinsight_nutanix,cluster stats hypervisor hyperv cpu usage ppm,,
logicinsight.pe.cluster_stats_hypervisor_hyperv_memory_usage_ppm,gauge,15,,,Memory usage specific to Hyper-V hypervisors,-1,logicinsight_nutanix,cluster stats hypervisor hyperv memory usage ppm,,
logicinsight.pe.cluster_stats_hypervisor_io_bandwidth_kBps,gauge,15,,,Total I/O bandwidth across all hypervisors,1,logicinsight_nutanix,cluster stats hypervisor io bandwidth kBps,,
logicinsight.pe.cluster_stats_hypervisor_kvm_cpu_usage_ppm,gauge,15,,,CPU usage specific to KVM hypervisors,-1,logicinsight_nutanix,cluster stats hypervisor kvm cpu usage ppm,,
logicinsight.pe.cluster_stats_hypervisor_kvm_memory_usage_ppm,gauge,15,,,Memory usage specific to KVM hypervisors,-1,logicinsight_nutanix,cluster stats hypervisor kvm memory usage ppm,,
logicinsight.pe.cluster_stats_hypervisor_memory_usage_ppm,gauge,15,,,Total memory usage across all hypervisors,-1,logicinsight_nutanix,cluster stats hypervisor memory usage ppm,,
logicinsight.pe.cluster_stats_hypervisor_num_io,gauge,15,,,Total number of I/O operations handled by the hypervisor layer.,1,logicinsight_nutanix,cluster stats hypervisor num io,,
logicinsight.pe.cluster_stats_hypervisor_num_iops,gauge,15,,,Total number of IOPS measured at the hypervisor level.,1,logicinsight_nutanix,cluster stats hypervisor num iops,,
logicinsight.pe.cluster_stats_hypervisor_num_read_io,gauge,15,,,Total number of read I/O operations performed by the hypervisor.,1,logicinsight_nutanix,cluster stats hypervisor num read io,,
logicinsight.pe.cluster_stats_hypervisor_num_read_iops,gauge,15,,,Read IOPS measured from the hypervisor.,1,logicinsight_nutanix,cluster stats hypervisor num read iops,,
logicinsight.pe.cluster_stats_hypervisor_num_write_io,gauge,15,,,Total number of write I/O operations performed by the hypervisor.,1,logicinsight_nutanix,cluster stats hypervisor num write io,,
logicinsight.pe.cluster_stats_hypervisor_num_write_iops,gauge,15,,,Write IOPS measured from the hypervisor.,1,logicinsight_nutanix,cluster stats hypervisor num write iops,,
logicinsight.pe.cluster_stats_hypervisor_read_io_bandwidth_kBps,gauge,15,,,Read I/O bandwidth from the hypervisor,1,logicinsight_nutanix,cluster stats hypervisor read io bandwidth kBps,,
logicinsight.pe.cluster_stats_hypervisor_timespan_usecs,gauge,15,,,Time window over which hypervisor metrics ,1,logicinsight_nutanix,cluster stats hypervisor timespan usecs,,
logicinsight.pe.cluster_stats_hypervisor_total_io_size_kbytes,gauge,15,,,Total size of all I/O operations measured at the hypervisor,1,logicinsight_nutanix,cluster stats hypervisor total io size kbytes,,
logicinsight.pe.cluster_stats_hypervisor_total_io_time_usecs,gauge,15,,,Total time spent on I/O operations by the hypervisor,1,logicinsight_nutanix,cluster stats hypervisor total io time usecs,,
logicinsight.pe.cluster_stats_hypervisor_total_read_io_size_kbytes,gauge,15,,,Total size of read I/O operations handled by the hypervisor,1,logicinsight_nutanix,cluster stats hypervisor total read io size kbytes,,
logicinsight.pe.cluster_stats_hypervisor_total_read_io_time_usecs,gauge,15,,,Total time spent on read I/O operations by the hypervisor,1,logicinsight_nutanix,cluster stats hypervisor total read io time usecs,,
logicinsight.pe.cluster_stats_hypervisor_write_io_bandwidth_kBps,gauge,15,,,Write I/O bandwidth from the hypervisor,1,logicinsight_nutanix,cluster stats hypervisor write io bandwidth kBps,,
logicinsight.pe.cluster_stats_io_bandwidth_kBps,gauge,15,,,Total I/O bandwidth at the cluster level,1,logicinsight_nutanix,cluster stats io bandwidth kBps,,
logicinsight.pe.cluster_stats_num_io,gauge,15,,,Total number of I/O operations performed cluster-wide.,1,logicinsight_nutanix,cluster stats num io,,
logicinsight.pe.cluster_stats_num_iops,gauge,15,,,Total IOPS (I/O operations per second) cluster-wide.,1,logicinsight_nutanix,cluster stats num iops,,
logicinsight.pe.cluster_stats_num_random_io,gauge,15,,,Number of random I/O operations performed in the cluster.,1,logicinsight_nutanix,cluster stats num random io,,
logicinsight.pe.cluster_stats_num_read_io,gauge,15,,,Number of read I/O operations performed in the cluster.,1,logicinsight_nutanix,cluster stats num read io,,
logicinsight.pe.cluster_stats_num_read_iops,gauge,15,,,Read IOPS measured at the cluster level.,1,logicinsight_nutanix,cluster stats num read iops,,
logicinsight.pe.cluster_stats_num_seq_io,gauge,15,,,Number of sequential I/O operations performed in the cluster.,1,logicinsight_nutanix,cluster stats num seq io,,
logicinsight.pe.cluster_stats_num_write_io,gauge,15,,,Number of write I/O operations performed in the cluster.,1,logicinsight_nutanix,cluster stats num write io,,
logicinsight.pe.cluster_stats_num_write_iops,gauge,15,,,Write IOPS measured at the cluster level.,1,logicinsight_nutanix,cluster stats num write iops,,
logicinsight.pe.cluster_stats_random_io_ppm,gauge,15,,,Percentage of I/O operations that were random.,1,logicinsight_nutanix,cluster stats random io ppm,,
logicinsight.pe.cluster_stats_read_io_bandwidth_kBps,gauge,15,,,Read I/O bandwidth in the cluster,1,logicinsight_nutanix,cluster stats read io bandwidth kBps,,
logicinsight.pe.cluster_stats_read_io_ppm,gauge,15,,,Percentage of I/O operations that were reads.,1,logicinsight_nutanix,cluster stats read io ppm,,
logicinsight.pe.cluster_stats_replication_num_received_bytes,gauge,15,,,Total number of bytes received via replication.,1,logicinsight_nutanix,cluster stats replication num received bytes,,
logicinsight.pe.cluster_stats_replication_num_transmitted_bytes,gauge,15,,,Total number of bytes transmitted via replication.,1,logicinsight_nutanix,cluster stats replication num transmitted bytes,,
logicinsight.pe.cluster_stats_replication_received_bandwidth_kBps,gauge,15,,,Inbound replication bandwidth,1,logicinsight_nutanix,cluster stats replication received bandwidth kBps,,
logicinsight.pe.cluster_stats_replication_transmitted_bandwidth_kBps,gauge,15,,,Outbound replication bandwidth,1,logicinsight_nutanix,cluster stats replication transmitted bandwidth kBps,,
logicinsight.pe.cluster_stats_seq_io_ppm,gauge,15,,,Percentage of I/O operations that were sequential.,1,logicinsight_nutanix,cluster stats seq io ppm,,
logicinsight.pe.cluster_stats_timespan_usecs,gauge,15,,,Time window over which cluster metrics were collected,1,logicinsight_nutanix,cluster stats timespan usecs,,
logicinsight.pe.cluster_stats_total_io_size_kbytes,gauge,15,,,Total size of all I/O operations in the cluster,1,logicinsight_nutanix,cluster stats total io size kbytes,,
logicinsight.pe.cluster_stats_total_io_time_usecs,gauge,15,,,Total time spent on I/O operations across the cluster,1,logicinsight_nutanix,cluster stats total io time usecs,,
logicinsight.pe.cluster_stats_total_read_io_size_kbytes,gauge,15,,,Total size of read I/O operations in the cluster,1,logicinsight_nutanix,cluster stats total read io size kbytes,,
logicinsight.pe.cluster_stats_total_read_io_time_usecs,gauge,15,,,Total time spent on read I/O operations in the cluster,1,logicinsight_nutanix,cluster stats total read io time usecs,,
logicinsight.pe.cluster_stats_total_transformed_usage_bytes,gauge,15,,,Total amount of transformed storage usage in the cluster,1,logicinsight_nutanix,cluster stats total transformed usage bytes,,
logicinsight.pe.cluster_stats_total_untransformed_usage_bytes,gauge,15,,,Total amount of untransformed storage usage in the cluster,1,logicinsight_nutanix,cluster stats total untransformed usage bytes,,
logicinsight.pe.cluster_stats_write_io_bandwidth_kBps,gauge,15,,,Write I/O bandwidth across the cluster,1,logicinsight_nutanix,cluster stats write io bandwidth kBps,,
logicinsight.pe.cluster_stats_write_io_ppm,gauge,15,,,Percentage of I/O operations that were writes.,1,logicinsight_nutanix,cluster stats write io ppm,,
logicinsight.pe.cluster_total_hz,gauge,15,,,Total CPU frequency across the cluster,1,logicinsight_nutanix,cluster total hz,,
logicinsight.pe.cluster_total_memory_bytes,gauge,15,,,Total memory allocated in the cluster,1,logicinsight_nutanix,cluster total memory bytes,,
logicinsight.pe.cluster_total_pcores,gauge,15,,,Total number of physical cores (pCores) available in the cluster.,1,logicinsight_nutanix,cluster total physical cores,,
logicinsight.pe.cluster_total_vcpus,gauge,15,,,Total number of virtual CPUs (vCPUs) assigned across the cluster.,1,logicinsight_nutanix,cluster total vcpus,,
logicinsight.pe.cluster_total_vcpus_all,gauge,15,,,Total number of virtual CPUs  in the cluster.,1,logicinsight_nutanix,cluster total vcpus for charge,,
logicinsight.pe.cluster_usage_stats_data_reduction.clone.saved_bytes,gauge,15,,,Bytes saved by clone-based data reduction techniques.,1,logicinsight_nutanix,cluster usage stats data reduction.clone.saved bytes,,
logicinsight.pe.cluster_usage_stats_data_reduction.clone.saving_ratio_ppm,gauge,15,,,Clone-based data reduction ratio,1,logicinsight_nutanix,cluster usage stats data reduction.clone.saving ratio ppm,,
logicinsight.pe.cluster_usage_stats_data_reduction.compression.post_reduction_bytes,gauge,15,,,Bytes remaining after compression was applied.,1,logicinsight_nutanix,cluster usage stats data reduction.compression.post reduction bytes,,
logicinsight.pe.cluster_usage_stats_data_reduction.compression.pre_reduction_bytes,gauge,15,,,Original size before compression was applied.,1,logicinsight_nutanix,cluster usage stats data reduction.compression.pre reduction bytes,,
logicinsight.pe.cluster_usage_stats_data_reduction.compression.saved_bytes,gauge,15,,,Bytes saved through compression.,1,logicinsight_nutanix,cluster usage stats data reduction.compression.saved bytes,,
logicinsight.pe.cluster_usage_stats_data_reduction.compression.saving_ratio_ppm,gauge,15,,,Compression efficiency ratio,1,logicinsight_nutanix,cluster usage stats data reduction.compression.saving ratio ppm,,
logicinsight.pe.cluster_usage_stats_data_reduction.dedup.post_reduction_bytes,gauge,15,,,Bytes remaining after deduplication.,1,logicinsight_nutanix,cluster usage stats data reduction.dedup.post reduction bytes,,
logicinsight.pe.cluster_usage_stats_data_reduction.dedup.pre_reduction_bytes,gauge,15,,,Original size before deduplication.,1,logicinsight_nutanix,cluster usage stats data reduction.dedup.pre reduction bytes,,
logicinsight.pe.cluster_usage_stats_data_reduction.dedup.saved_bytes,gauge,15,,,Bytes saved through deduplication.,1,logicinsight_nutanix,cluster usage stats data reduction.dedup.saved bytes,,
logicinsight.pe.cluster_usage_stats_data_reduction.dedup.saving_ratio_ppm,gauge,15,,,Deduplication efficiency ratio,1,logicinsight_nutanix,cluster usage stats data reduction.dedup.saving ratio ppm,,
logicinsight.pe.cluster_usage_stats_data_reduction.erasure_coding.post_reduction_bytes,gauge,15,,,Bytes remaining after erasure coding was applied.,1,logicinsight_nutanix,cluster usage stats data reduction.erasure coding.post reduction bytes,,
logicinsight.pe.cluster_usage_stats_data_reduction.erasure_coding.pre_reduction_bytes,gauge,15,,,Original size before erasure coding.,1,logicinsight_nutanix,cluster usage stats data reduction.erasure coding.pre reduction bytes,,
logicinsight.pe.cluster_usage_stats_data_reduction.erasure_coding.saved_bytes,gauge,15,,,Bytes saved through erasure coding.,1,logicinsight_nutanix,cluster usage stats data reduction.erasure coding.saved bytes,,
logicinsight.pe.cluster_usage_stats_data_reduction.erasure_coding.saving_ratio_ppm,gauge,15,,,Erasure coding efficiency ratio,1,logicinsight_nutanix,cluster usage stats data reduction.erasure coding.saving ratio ppm,,
logicinsight.pe.cluster_usage_stats_data_reduction.overall.saved_bytes,gauge,15,,,Total bytes saved across all data reduction methods.,1,logicinsight_nutanix,cluster usage stats data reduction.overall.saved bytes,,
logicinsight.pe.cluster_usage_stats_data_reduction.overall.saving_ratio_ppm,gauge,15,,,Overall data reduction efficiency,1,logicinsight_nutanix,cluster usage stats data reduction.overall.saving ratio ppm,,
logicinsight.pe.cluster_usage_stats_data_reduction.post_reduction_bytes,gauge,15,,,Total data remaining after all reductions.,1,logicinsight_nutanix,cluster usage stats data reduction.post reduction bytes,,
logicinsight.pe.cluster_usage_stats_data_reduction.pre_reduction_bytes,gauge,15,,,Total data size before reductions.,1,logicinsight_nutanix,cluster usage stats data reduction.pre reduction bytes,,
logicinsight.pe.cluster_usage_stats_data_reduction.saved_bytes,gauge,15,,,Total amount of saved space due to all data reduction methods.,1,logicinsight_nutanix,cluster usage stats data reduction.saved bytes,,
logicinsight.pe.cluster_usage_stats_data_reduction.saving_ratio_ppm,gauge,15,,,Overall saving ratio across all data reduction types,1,logicinsight_nutanix,cluster usage stats data reduction.saving ratio ppm,,
logicinsight.pe.cluster_usage_stats_data_reduction.thin_provision.post_reduction_bytes,gauge,15,,,Bytes remaining after thin provisioning.,1,logicinsight_nutanix,cluster usage stats data reduction.thin provision.post reduction bytes,,
logicinsight.pe.cluster_usage_stats_data_reduction.thin_provision.pre_reduction_bytes,gauge,15,,,Original size before thin provisioning.,1,logicinsight_nutanix,cluster usage stats data reduction.thin provision.pre reduction bytes,,
logicinsight.pe.cluster_usage_stats_data_reduction.thin_provision.saved_bytes,gauge,15,,,Bytes saved through thin provisioning.,1,logicinsight_nutanix,cluster usage stats data reduction.thin provision.saved bytes,,
logicinsight.pe.cluster_usage_stats_data_reduction.thin_provision.saving_ratio_ppm,gauge,15,,,Thin provisioning efficiency,1,logicinsight_nutanix,cluster usage stats data reduction.thin provision.saving ratio ppm,,
logicinsight.pe.cluster_usage_stats_storage.capacity_bytes,gauge,15,,,Total physical storage capacity in the cluster.,1,logicinsight_nutanix,cluster usage stats storage.capacity bytes,,
logicinsight.pe.cluster_usage_stats_storage.free_bytes,gauge,15,,,Free physical storage available in the cluster.,1,logicinsight_nutanix,cluster usage stats storage.free bytes,,
logicinsight.pe.cluster_usage_stats_storage.logical_usage_bytes,gauge,15,,,Logical storage usage in the cluster after data reduction.,1,logicinsight_nutanix,cluster usage stats storage.logical usage bytes,,
logicinsight.pe.cluster_usage_stats_storage.rebuild_capacity_bytes,gauge,15,,,Capacity required to rebuild lost data.,1,logicinsight_nutanix,cluster usage stats storage.rebuild capacity bytes,,
logicinsight.pe.cluster_usage_stats_storage.recycle_bin_usage_bytes,gauge,15,,,Amount of space used by deleted files in the recycle bin.,1,logicinsight_nutanix,cluster usage stats storage.recycle bin usage bytes,,
logicinsight.pe.cluster_usage_stats_storage.reserved_capacity_bytes,gauge,15,,,Storage reserved for system or failover use.,1,logicinsight_nutanix,cluster usage stats storage.reserved capacity bytes,,
logicinsight.pe.cluster_usage_stats_storage.reserved_free_bytes,gauge,15,,,Free portion of the reserved storage.,1,logicinsight_nutanix,cluster usage stats storage.reserved free bytes,,
