metric_name,metric_type,interval,unit_name,per_unit_name,description,orientation,integration,short_name,curated_metric,sample_tags
logicinsight.pe.container_usage_stats_storage.recycle_bin_logical_usage_bytes,gauge,15,,,Recycle bin logical usage in bytes,0,logicinsight_nutanix,container usage stats storage.recycle bin logical usage bytes,,
logicinsight.pe.container_usage_stats_storage.recycle_bin_usage_bytes,gauge,15,,,Total recycle bin usage in bytes,0,logicinsight_nutanix,container usage stats storage.recycle bin usage bytes,,
logicinsight.pe.container_usage_stats_storage.reserved_capacity_bytes,gauge,15,,,Total reserved capacity in bytes,0,logicinsight_nutanix,container usage stats storage.reserved capacity bytes,,
logicinsight.pe.container_usage_stats_storage.reserved_free_bytes,gauge,15,,,Reserved free bytes in the container,0,logicinsight_nutanix,container usage stats storage.reserved free bytes,,
logicinsight.pe.container_usage_stats_storage.reserved_usage_bytes,gauge,15,,,Reserved usage in the container,0,logicinsight_nutanix,container usage stats storage.reserved usage bytes,,
logicinsight.pe.container_usage_stats_storage.snapshot_reclaimable_bytes,gauge,15,,,Snapshot reclaimable bytes,0,logicinsight_nutanix,container usage stats storage.snapshot reclaimable bytes,,
logicinsight.pe.container_usage_stats_storage.unreserved_capacity_bytes,gauge,15,,,Unreserved capacity in the container,1,logicinsight_nutanix,container usage stats storage.unreserved capacity bytes,,
logicinsight.pe.container_usage_stats_storage.unreserved_free_bytes,gauge,15,,,Unreserved free bytes,1,logicinsight_nutanix,container usage stats storage.unreserved free bytes,,
logicinsight.pe.container_usage_stats_storage.unreserved_own_usage_bytes,gauge,15,,,Unreserved own usage in bytes,0,logicinsight_nutanix,container usage stats storage.unreserved own usage bytes,,
logicinsight.pe.container_usage_stats_storage.unreserved_usage_bytes,gauge,15,,,Total unreserved usage in bytes,0,logicinsight_nutanix,container usage stats storage.unreserved usage bytes,,
logicinsight.pe.container_usage_stats_storage.usage_bytes,gauge,15,,,Overall usage in the container,1,logicinsight_nutanix,container usage stats storage.usage bytes,,
logicinsight.pe.container_usage_stats_storage.user_capacity_bytes,gauge,15,,,Total user capacity in bytes,0,logicinsight_nutanix,container usage stats storage.user capacity bytes,,
logicinsight.pe.container_usage_stats_storage.user_container_own_usage_bytes,gauge,15,,,User container's own usage in bytes,0,logicinsight_nutanix,container usage stats storage.user container own usage bytes,,
logicinsight.pe.container_usage_stats_storage.user_container_reserved_capacity_bytes,gauge,15,,,Reserved capacity for user container,0,logicinsight_nutanix,container usage stats storage.user container reserved capacity bytes,,
logicinsight.pe.container_usage_stats_storage.user_disk_physical_usage_bytes,gauge,15,,,Physical usage of user disks in bytes,1,logicinsight_nutanix,container usage stats storage.user disk physical usage bytes,,
logicinsight.pe.container_usage_stats_storage.user_free_bytes,gauge,15,,,Free bytes for user,1,logicinsight_nutanix,container usage stats storage.user free bytes,,
logicinsight.pe.container_usage_stats_storage.user_other_containers_reserved_capacity_bytes,gauge,15,,,Reserved capacity for other user containers in bytes,0,logicinsight_nutanix,container usage stats storage.user other containers reserved capacity bytes,,
logicinsight.pe.container_usage_stats_storage.user_reserved_capacity_bytes,gauge,15,,,User reserved capacity in bytes,0,logicinsight_nutanix,container usage stats storage.user reserved capacity bytes,,
logicinsight.pe.container_usage_stats_storage.user_reserved_free_bytes,gauge,15,,,User reserved free bytes,0,logicinsight_nutanix,container usage stats storage.user reserved free bytes,,
logicinsight.pe.container_usage_stats_storage.user_reserved_usage_bytes,gauge,15,,,User reserved usage bytes,0,logicinsight_nutanix,container usage stats storage.user reserved usage bytes,,
logicinsight.pe.container_usage_stats_storage.user_storage_pool_capacity_bytes,gauge,15,,,Total capacity in the users storage pool,0,logicinsight_nutanix,container usage stats storage.user storage pool capacity bytes,,
logicinsight.pe.container_usage_stats_storage.user_unreserved_capacity_bytes,gauge,15,,,Unreserved user capacity in bytes,1,logicinsight_nutanix,container usage stats storage.user unreserved capacity bytes,,
logicinsight.pe.container_usage_stats_storage.user_unreserved_free_bytes,gauge,15,,,Unreserved user free bytes,1,logicinsight_nutanix,container usage stats storage.user unreserved free bytes,,
logicinsight.pe.container_usage_stats_storage.user_unreserved_own_usage_bytes,gauge,15,,,User unreserved own usage in bytes,0,logicinsight_nutanix,container usage stats storage.user unreserved own usage bytes,,
logicinsight.pe.container_usage_stats_storage.user_unreserved_shared_usage_bytes,gauge,15,,,User unreserved shared usage bytes,0,logicinsight_nutanix,container usage stats storage.user unreserved shared usage bytes,,
logicinsight.pe.container_usage_stats_storage.user_unreserved_usage_bytes,gauge,15,,,Total unreserved user usage bytes,0,logicinsight_nutanix,container usage stats storage.user unreserved usage bytes,,
logicinsight.pe.container_usage_stats_storage.user_usage_bytes,gauge,15,,,Total user usage bytes,1,logicinsight_nutanix,container usage stats storage.user usage bytes,,
logicinsight.pe.container_usage_stats_storage_tier.das_sata.usage_bytes,gauge,15,,,Usage in bytes on DAS-SATA tier,0,logicinsight_nutanix,container usage stats storage tier.das-sata.usage bytes,,
logicinsight.pe.container_usage_stats_storage_tier.ssd.usage_bytes,gauge,15,,,Usage in bytes on SSD tier,0,logicinsight_nutanix,container usage stats storage tier.ssd.usage bytes,,
logicinsight.pe.disk_bad,gauge,15,,,Indicates if disk is marked as bad,-1,logicinsight_nutanix,disk bad,,
logicinsight.pe.disk_location,gauge,15,,,Disk location description,0,logicinsight_nutanix,disk location,,
logicinsight.pe.disk_marked_for_removal,gauge,15,,,Disk is marked for removal,-1,logicinsight_nutanix,disk marked for removal,,
logicinsight.pe.disk_mounted,gauge,15,,,Whether the disk is mounted,1,logicinsight_nutanix,disk mounted,,
logicinsight.pe.disk_online,gauge,15,,,Disk online status,1,logicinsight_nutanix,disk online,,
logicinsight.pe.disk_size,gauge,15,,,Disk size in bytes,1,logicinsight_nutanix,disk size,,
logicinsight.pe.disk_stats_avg_io_latency_usecs,gauge,15,,,Average I/O latency for disk in microseconds,-1,logicinsight_nutanix,disk stats avg io latency usecs,,
logicinsight.pe.disk_stats_avg_read_io_latency_usecs,gauge,15,,,Average read I/O latency for disk in microseconds,-1,logicinsight_nutanix,disk stats avg read io latency usecs,,
logicinsight.pe.disk_stats_avg_write_io_latency_usecs,gauge,15,,,Average write I/O latency for disk in microseconds,-1,logicinsight_nutanix,disk stats avg write io latency usecs,,
logicinsight.pe.disk_stats_controller_avg_io_latency_usecs,gauge,15,,,Controller-side average I/O latency in microseconds,-1,logicinsight_nutanix,disk stats controller avg io latency usecs,,
logicinsight.pe.disk_stats_controller_avg_read_io_latency_usecs,gauge,15,,,Controller-side average read I/O latency in microseconds,-1,logicinsight_nutanix,disk stats controller avg read io latency usecs,,
logicinsight.pe.disk_stats_controller_avg_read_io_size_kbytes,gauge,15,,,Controller-side average read I/O size in kibibytes,1,logicinsight_nutanix,disk stats controller avg read io size kbytes,,
logicinsight.pe.disk_stats_controller_avg_write_io_latency_usecs,gauge,15,,,Controller-side average write I/O latency in microseconds,-1,logicinsight_nutanix,disk stats controller avg write io latency usecs,,
logicinsight.pe.disk_stats_controller_avg_write_io_size_kbytes,gauge,15,,,Controller-side average write I/O size in kibibytes,1,logicinsight_nutanix,disk stats controller avg write io size kbytes,,
logicinsight.pe.disk_stats_controller_io_bandwidth_kBps,gauge,15,,,Controller-side I/O bandwidth in kilobytes per second,1,logicinsight_nutanix,disk stats controller io bandwidth kBps,,
logicinsight.pe.disk_stats_controller_num_io,gauge,15,,,Total I/O operations at controller level,0,logicinsight_nutanix,disk stats controller num io,,
logicinsight.pe.disk_stats_controller_num_iops,gauge,15,,,IOPS at the controller level,0,logicinsight_nutanix,disk stats controller num iops,,
logicinsight.pe.disk_stats_controller_num_random_io,gauge,15,,,Number of random I/O operations at controller level,0,logicinsight_nutanix,disk stats controller num random io,,
logicinsight.pe.disk_stats_controller_num_read_io,gauge,15,,,Number of read I/O operations at controller level,0,logicinsight_nutanix,disk stats controller num read io,,
logicinsight.pe.disk_stats_controller_num_read_iops,gauge,15,,,Number of read IOPS at controller level,0,logicinsight_nutanix,disk stats controller num read iops,,
logicinsight.pe.disk_stats_controller_num_seq_io,gauge,15,,,Number of sequential I/O operations at controller level,0,logicinsight_nutanix,disk stats controller num seq io,,
logicinsight.pe.disk_stats_controller_num_write_io,gauge,15,,,Number of write I/O operations at controller level,1,logicinsight_nutanix,disk stats controller num write io,,
logicinsight.pe.disk_stats_controller_num_write_iops,gauge,15,,,Number of write IOPS at controller level,1,logicinsight_nutanix,disk stats controller num write iops,,
logicinsight.pe.disk_stats_controller_random_io_ppm,gauge,15,,,Random I/O ratio at controller level in ppm,0,logicinsight_nutanix,disk stats controller random io ppm,,
logicinsight.pe.disk_stats_controller_read_io_bandwidth_kBps,gauge,15,,,Controller-side read I/O bandwidth in kilobytes per second,0,logicinsight_nutanix,disk stats controller read io bandwidth kBps,,
logicinsight.pe.disk_stats_controller_read_io_ppm,gauge,15,,,Read I/O operations at controller level in ppm,0,logicinsight_nutanix,disk stats controller read io ppm,,
logicinsight.pe.disk_stats_controller_seq_io_ppm,gauge,15,,,Sequential I/O at controller level in ppm,0,logicinsight_nutanix,disk stats controller seq io ppm,,
logicinsight.pe.disk_stats_controller_timespan_usecs,gauge,15,,,Duration for controller-side metrics in microseconds,0,logicinsight_nutanix,disk stats controller timespan usecs,,
logicinsight.pe.disk_stats_controller_total_io_size_kbytes,gauge,15,,,Total size of I/O at controller level in kibibytes,1,logicinsight_nutanix,disk stats controller total io size kbytes,,
logicinsight.pe.disk_stats_controller_total_io_time_usecs,gauge,15,,,Total I/O time at controller level in microseconds,1,logicinsight_nutanix,disk stats controller total io time usecs,,
logicinsight.pe.disk_stats_controller_total_read_io_size_kbytes,gauge,15,,,Total read I/O size at controller level in kibibytes,0,logicinsight_nutanix,disk stats controller total read io size kbytes,,
logicinsight.pe.disk_stats_controller_total_read_io_time_usecs,gauge,15,,,Total read I/O time at controller level in microseconds,0,logicinsight_nutanix,disk stats controller total read io time usecs,,
logicinsight.pe.disk_stats_controller_total_transformed_usage_bytes,gauge,15,,,Total transformed usage from controller in bytes,0,logicinsight_nutanix,disk stats controller total transformed usage bytes,,
logicinsight.pe.disk_stats_controller_write_io_bandwidth_kBps,gauge,15,,,Write bandwidth at controller level in kilobytes per second,1,logicinsight_nutanix,disk stats controller write io bandwidth kBps,,
logicinsight.pe.disk_stats_controller_write_io_ppm,gauge,15,,,Write I/O in ppm from controller level,1,logicinsight_nutanix,disk stats controller write io ppm,,
logicinsight.pe.disk_stats_hypervisor_avg_io_latency_usecs,gauge,15,,,Average hypervisor-level I/O latency in microseconds,-1,logicinsight_nutanix,disk stats hypervisor avg io latency usecs,,
logicinsight.pe.disk_stats_hypervisor_avg_read_io_latency_usecs,gauge,15,,,Average hypervisor-level read I/O latency in microseconds,-1,logicinsight_nutanix,disk stats hypervisor avg read io latency usecs,,
logicinsight.pe.disk_stats_hypervisor_avg_write_io_latency_usecs,gauge,15,,,Average hypervisor-level write I/O latency in microseconds,-1,logicinsight_nutanix,disk stats hypervisor avg write io latency usecs,,
logicinsight.pe.disk_stats_hypervisor_io_bandwidth_kBps,gauge,15,,,I/O bandwidth at hypervisor level in kilobytes per second,1,logicinsight_nutanix,disk stats hypervisor io bandwidth kBps,,
logicinsight.pe.disk_stats_hypervisor_num_io,gauge,15,,,Total I/O count at hypervisor level,0,logicinsight_nutanix,disk stats hypervisor num io,,
logicinsight.pe.disk_stats_hypervisor_num_iops,gauge,15,,,Total IOPS at hypervisor level,0,logicinsight_nutanix,disk stats hypervisor num iops,,
logicinsight.pe.disk_stats_hypervisor_num_read_io,gauge,15,,,Number of read I/O operations at hypervisor level,0,logicinsight_nutanix,disk stats hypervisor num read io,,
logicinsight.pe.disk_stats_hypervisor_num_read_iops,gauge,15,,,Number of read IOPS at hypervisor level,0,logicinsight_nutanix,disk stats hypervisor num read iops,,
logicinsight.pe.disk_stats_hypervisor_num_write_io,gauge,15,,,Number of write I/O operations at hypervisor level,1,logicinsight_nutanix,disk stats hypervisor num write io,,
logicinsight.pe.disk_stats_hypervisor_num_write_iops,gauge,15,,,Number of write IOPS at hypervisor level,1,logicinsight_nutanix,disk stats hypervisor num write iops,,
logicinsight.pe.disk_stats_hypervisor_read_io_bandwidth_kBps,gauge,15,,,Read bandwidth from hypervisor in kilobytes per second,0,logicinsight_nutanix,disk stats hypervisor read io bandwidth kBps,,
logicinsight.pe.disk_stats_hypervisor_timespan_usecs,gauge,15,,,Hypervisor metrics duration in microseconds,0,logicinsight_nutanix,disk stats hypervisor timespan usecs,,
logicinsight.pe.disk_stats_hypervisor_total_io_size_kbytes,gauge,15,,,Total I/O size from hypervisor in kibibytes,1,logicinsight_nutanix,disk stats hypervisor total io size kbytes,,
logicinsight.pe.disk_stats_hypervisor_total_io_time_usecs,gauge,15,,,Total I/O time from hypervisor in microseconds,1,logicinsight_nutanix,disk stats hypervisor total io time usecs,,
logicinsight.pe.disk_stats_hypervisor_total_read_io_size_kbytes,gauge,15,,,Total read I/O size from hypervisor in kibibytes,0,logicinsight_nutanix,disk stats hypervisor total read io size kbytes,,
logicinsight.pe.disk_stats_hypervisor_total_read_io_time_usecs,gauge,15,,,Total read I/O time from hypervisor in microseconds,0,logicinsight_nutanix,disk stats hypervisor total read io time usecs,,
logicinsight.pe.disk_stats_hypervisor_write_io_bandwidth_kBps,gauge,15,,,Write bandwidth from hypervisor in kilobytes per second,1,logicinsight_nutanix,disk stats hypervisor write io bandwidth kBps,,
logicinsight.pe.disk_stats_io_bandwidth_kBps,gauge,15,,,I/O bandwidth at disk level in kilobytes per second,1,logicinsight_nutanix,disk stats io bandwidth kBps,,
logicinsight.pe.disk_stats_num_io,gauge,15,,,Total I/O operations at disk level,0,logicinsight_nutanix,disk stats num io,,
logicinsight.pe.disk_stats_num_iops,gauge,15,,,IOPS at disk level,0,logicinsight_nutanix,disk stats num iops,,
logicinsight.pe.disk_stats_num_random_io,gauge,15,,,Random I/O operations at disk level,0,logicinsight_nutanix,disk stats num random io,,
logicinsight.pe.disk_stats_num_read_io,gauge,15,,,Read operations at disk level,0,logicinsight_nutanix,disk stats num read io,,
logicinsight.pe.disk_stats_num_read_iops,gauge,15,,,Read IOPS at disk level,0,logicinsight_nutanix,disk stats num read iops,,
logicinsight.pe.disk_stats_num_seq_io,gauge,15,,,Sequential I/O operations at disk level,0,logicinsight_nutanix,disk stats num seq io,,
logicinsight.pe.disk_stats_num_write_io,gauge,15,,,Write operations at disk level,1,logicinsight_nutanix,disk stats num write io,,
logicinsight.pe.disk_stats_num_write_iops,gauge,15,,,Write IOPS at disk level,1,logicinsight_nutanix,disk stats num write iops,,
logicinsight.pe.disk_stats_random_io_ppm,gauge,15,,,Random I/O at disk level in ppm,0,logicinsight_nutanix,disk stats random io ppm,,
logicinsight.pe.disk_stats_read_io_bandwidth_kBps,gauge,15,,,Read bandwidth at disk level in kilobytes per second,0,logicinsight_nutanix,disk stats read io bandwidth kBps,,
logicinsight.pe.disk_stats_read_io_ppm,gauge,15,,,Read I/O at disk level in ppm,0,logicinsight_nutanix,disk stats read io ppm,,
logicinsight.pe.disk_stats_seq_io_ppm,gauge,15,,,Sequential I/O at disk level in ppm,0,logicinsight_nutanix,disk stats seq io ppm,,
logicinsight.pe.disk_stats_timespan_usecs,gauge,15,,,Time span of disk metrics in microseconds,0,logicinsight_nutanix,disk stats timespan usecs,,
logicinsight.pe.disk_stats_total_io_size_kbytes,gauge,15,,,Total size of I/O at disk level in kibibytes,1,logicinsight_nutanix,disk stats total io size kbytes,,
logicinsight.pe.disk_stats_total_io_time_usecs,gauge,15,,,Total time of I/O at disk level in microseconds,1,logicinsight_nutanix,disk stats total io time usecs,,
logicinsight.pe.disk_stats_total_read_io_size_kbytes,gauge,15,,,Total read size at disk level in kibibytes,0,logicinsight_nutanix,disk stats total read io size kbytes,,
logicinsight.pe.disk_stats_total_read_io_time_usecs,gauge,15,,,Total read I/O time at disk level in microseconds,0,logicinsight_nutanix,disk stats total read io time usecs,,
logicinsight.pe.disk_stats_total_transformed_usage_bytes,gauge,15,,,Total transformed usage at disk level in bytes,0,logicinsight_nutanix,disk stats total transformed usage bytes,,
logicinsight.pe.disk_stats_total_untransformed_usage_bytes,gauge,15,,,Total untransformed usage at disk level in bytes,0,logicinsight_nutanix,disk stats total untransformed usage bytes,,
logicinsight.pe.disk_stats_write_io_bandwidth_kBps,gauge,15,,,Write I/O bandwidth at disk level in kilobytes per second,1,logicinsight_nutanix,disk stats write io bandwidth kBps,,
logicinsight.pe.disk_stats_write_io_ppm,gauge,15,,,Write I/O at disk level in ppm,1,logicinsight_nutanix,disk stats write io ppm,,
logicinsight.pe.disk_usage_stats_storage.capacity_bytes,gauge,15,,,Total storage capacity of the disk,0,logicinsight_nutanix,disk usage stats storage.capacity bytes,,
logicinsight.pe.disk_usage_stats_storage.free_bytes,gauge,15,,,Free space in the disk,1,logicinsight_nutanix,disk usage stats storage.free bytes,,
logicinsight.pe.disk_usage_stats_storage.logical_usage_bytes,gauge,15,,,Logical usage on the disk,0,logicinsight_nutanix,disk usage stats storage.logical usage bytes,,
logicinsight.pe.disk_usage_stats_storage.usage_bytes,gauge,15,,,Overall usage of the disk,1,logicinsight_nutanix,disk usage stats storage.usage bytes,,
logicinsight.pe.host_boot_time_in_usecs,gauge,15,,,Host boot time in microseconds,0,logicinsight_nutanix,host boot time in usecs,,
logicinsight.pe.host_cpu_frequency_in_hz,gauge,15,,,CPU frequency of the host in hertz,1,logicinsight_nutanix,host cpu frequency in hz,,
logicinsight.pe.host_hypervisor_state,gauge,15,,,State of the hypervisor on the host,0,logicinsight_nutanix,host hypervisor state,,
logicinsight.pe.host_in_maintenance_mode,gauge,15,,,Indicates if the host is in maintenance mode,0,logicinsight_nutanix,host in maintenance mode,,
logicinsight.pe.host_is_degraded,gauge,15,,,Indicates if the host is degraded,-1,logicinsight_nutanix,host is degraded,,
logicinsight.pe.host_memory_capacity_in_bytes,gauge,15,,,Total memory capacity of the host in bytes,1,logicinsight_nutanix,host memory capacity in bytes,,
logicinsight.pe.host_metrics_storage.capacity_bytes,gauge,15,,,Total storage capacity from host metrics,0,logicinsight_nutanix,host metrics storage.capacity bytes,,
logicinsight.pe.host_metrics_storage.free_bytes,gauge,15,,,Free storage from host metrics,1,logicinsight_nutanix,host metrics storage.free bytes,,
logicinsight.pe.host_metrics_storage.logical_usage_bytes,gauge,15,,,Logical storage usage from host metrics,0,logicinsight_nutanix,host metrics storage.logical usage bytes,,
logicinsight.pe.host_metrics_storage.usage_bytes,gauge,15,,,Overall usage from host metrics,1,logicinsight_nutanix,host metrics storage.usage bytes,,
logicinsight.pe.host_metrics_storage_tier.das_sata.capacity_bytes,gauge,15,,,Storage tier DAS-SATA capacity in host metrics,0,logicinsight_nutanix,host metrics storage tier.das-sata.capacity bytes,,
logicinsight.pe.host_metrics_storage_tier.das_sata.free_bytes,gauge,15,,,Storage tier DAS-SATA free space in host metrics,0,logicinsight_nutanix,host metrics storage tier.das-sata.free bytes,,
logicinsight.pe.host_metrics_storage_tier.das_sata.usage_bytes,gauge,15,,,Storage tier DAS-SATA usage in host metrics,0,logicinsight_nutanix,host metrics storage tier.das-sata.usage bytes,,
logicinsight.pe.host_metrics_storage_tier.ssd.capacity_bytes,gauge,15,,,Storage tier SSD capacity in host metrics,0,logicinsight_nutanix,host metrics storage tier.ssd.capacity bytes,,
logicinsight.pe.host_metrics_storage_tier.ssd.free_bytes,gauge,15,,,Storage tier SSD free space in host metrics,0,logicinsight_nutanix,host metrics storage tier.ssd.free bytes,,
logicinsight.pe.host_metrics_storage_tier.ssd.usage_bytes,gauge,15,,,Storage tier SSD usage in host metrics,0,logicinsight_nutanix,host metrics storage tier.ssd.usage bytes,,
logicinsight.pe.host_num_cpu_cores,gauge,15,,,Total number of physical CPU cores in host,1,logicinsight_nutanix,host num cpu cores,,
logicinsight.pe.host_num_cpu_sockets,gauge,15,,,Total number of CPU sockets in host,1,logicinsight_nutanix,host num cpu sockets,,
logicinsight.pe.host_num_cpu_threads,gauge,15,,,Total number of logical CPU threads in host,1,logicinsight_nutanix,host num cpu threads,,
logicinsight.pe.host_num_vms,gauge,15,,,Total number of VMs on the host,0,logicinsight_nutanix,host num vms,,
logicinsight.pe.host_state,gauge,15,,,Current state of the host,0,logicinsight_nutanix,host state,,
logicinsight.pe.host_stats,gauge,15,,,Aggregated statistics for the host,0,logicinsight_nutanix,host stats,,
logicinsight.pe.host_stats_avg_io_latency_usecs,gauge,15,,,Average I/O latency at host level in microseconds,-1,logicinsight_nutanix,host stats avg io latency usecs,,
logicinsight.pe.host_stats_avg_read_io_latency_usecs,gauge,15,,,Average read I/O latency at host level in microseconds,-1,logicinsight_nutanix,host stats avg read io latency usecs,,
logicinsight.pe.host_stats_avg_write_io_latency_usecs,gauge,15,,,Average write I/O latency at host level in microseconds,-1,logicinsight_nutanix,host stats avg write io latency usecs,,
logicinsight.pe.host_stats_content_cache_hit_ppm,gauge,15,,,Content cache hit ratio on host in ppm,1,logicinsight_nutanix,host stats content cache hit ppm,,
logicinsight.pe.host_stats_content_cache_logical_memory_usage_bytes,gauge,15,,,Logical memory usage in the content cache on host in bytes,1,logicinsight_nutanix,host stats content cache logical memory usage bytes,,
logicinsight.pe.host_stats_content_cache_logical_ssd_usage_bytes,gauge,15,,,Logical SSD usage by host content cache,1,logicinsight_nutanix,host stats content cache logical ssd usage bytes,,
logicinsight.pe.host_stats_content_cache_num_dedup_ref_count_pph,gauge,15,,,Deduplication reference count per hour in content cache,0,logicinsight_nutanix,host stats content cache num dedup ref count pph,,
logicinsight.pe.host_stats_content_cache_num_lookups,gauge,15,,,Number of lookups in content cache,1,logicinsight_nutanix,host stats content cache num lookups,,
logicinsight.pe.host_stats_content_cache_physical_memory_usage_bytes,gauge,15,,,Physical memory usage in content cache,0,logicinsight_nutanix,host stats content cache physical memory usage bytes,,
logicinsight.pe.host_stats_content_cache_physical_ssd_usage_bytes,gauge,15,,,Physical SSD usage in content cache,0,logicinsight_nutanix,host stats content cache physical ssd usage bytes,,
logicinsight.pe.host_stats_content_cache_saved_memory_usage_bytes,gauge,15,,,Saved memory usage by content cache,1,logicinsight_nutanix,host stats content cache saved memory usage bytes,,
logicinsight.pe.host_stats_content_cache_saved_ssd_usage_bytes,gauge,15,,,Saved SSD usage by content cache,1,logicinsight_nutanix,host stats content cache saved ssd usage bytes,,
logicinsight.pe.host_stats_controller_avg_io_latency_usecs,gauge,15,,,Average I/O latency from host controller,-1,logicinsight_nutanix,host stats controller avg io latency usecs,,
logicinsight.pe.host_stats_controller_avg_read_io_latency_usecs,gauge,15,,,Average read I/O latency from host controller,-1,logicinsight_nutanix,host stats controller avg read io latency usecs,,
logicinsight.pe.host_stats_controller_avg_read_io_size_kbytes,gauge,15,,,Average read I/O size from host controller,1,logicinsight_nutanix,host stats controller avg read io size kbytes,,
logicinsight.pe.host_stats_controller_avg_write_io_latency_usecs,gauge,15,,,Average write I/O latency from host controller,-1,logicinsight_nutanix,host stats controller avg write io latency usecs,,
logicinsight.pe.host_stats_controller_avg_write_io_size_kbytes,gauge,15,,,Average write I/O size from host controller,1,logicinsight_nutanix,host stats controller avg write io size kbytes,,
logicinsight.pe.host_stats_controller_io_bandwidth_kBps,gauge,15,,,I/O bandwidth from host controller in kBps,1,logicinsight_nutanix,host stats controller io bandwidth kBps,,
logicinsight.pe.host_stats_controller_num_io,gauge,15,,,Total number of I/O operations by host controller,1,logicinsight_nutanix,host stats controller num io,,
logicinsight.pe.host_stats_controller_num_iops,gauge,15,,,Number of IOPS by host controller,1,logicinsight_nutanix,host stats controller num iops,,
logicinsight.pe.host_stats_controller_num_random_io,gauge,15,,,Number of random I/O operations by host controller,1,logicinsight_nutanix,host stats controller num random io,,
logicinsight.pe.host_stats_controller_num_read_io,gauge,15,,,Number of read I/O operations by host controller,1,logicinsight_nutanix,host stats controller num read io,,
