metric_name,metric_type,interval,unit_name,per_unit_name,description,orientation,integration,short_name,curated_metric,sample_tags
logicinsight.pe.cluster_usage_stats_storage.reserved_usage_bytes,gauge,15,,,Used portion of the reserved storage.,1,logicinsight_nutanix,cluster usage stats storage.reserved usage bytes,,
logicinsight.pe.cluster_usage_stats_storage.snapshot_reclaimable_bytes,gauge,15,,,Amount of space that can be reclaimed from snapshots.,1,logicinsight_nutanix,cluster usage stats storage.snapshot reclaimable bytes,,
logicinsight.pe.cluster_usage_stats_storage.usage_bytes,gauge,15,,,Total used storage in the cluster.,1,logicinsight_nutanix,cluster usage stats storage.usage bytes,,
logicinsight.pe.cluster_usage_stats_storage_tier.das_sata.capacity_bytes,gauge,15,,,Total capacity of DAS-SATA tier storage.,1,logicinsight_nutanix,cluster usage stats storage tier.das-sata.capacity bytes,,
logicinsight.pe.cluster_usage_stats_storage_tier.das_sata.free_bytes,gauge,15,,,Free space in the DAS-SATA tier.,1,logicinsight_nutanix,cluster usage stats storage tier.das-sata.free bytes,,
logicinsight.pe.cluster_usage_stats_storage_tier.das_sata.pinned_bytes,gauge,15,,,Pinned storage in the DAS-SATA tier.,1,logicinsight_nutanix,cluster usage stats storage tier.das-sata.pinned bytes,,
logicinsight.pe.cluster_usage_stats_storage_tier.das_sata.pinned_usage_bytes,gauge,15,,,Used portion of pinned storage in the DAS-SATA tier.,1,logicinsight_nutanix,cluster usage stats storage tier.das-sata.pinned usage bytes,,
logicinsight.pe.cluster_usage_stats_storage_tier.das_sata.usage_bytes,gauge,15,,,Total used space in the DAS-SATA tier.,1,logicinsight_nutanix,cluster usage stats storage tier.das-sata.usage bytes,,
logicinsight.pe.cluster_usage_stats_storage_tier.ssd.capacity_bytes,gauge,15,,,Total capacity of SSD tier storage.,1,logicinsight_nutanix,cluster usage stats storage tier.ssd.capacity bytes,,
logicinsight.pe.cluster_usage_stats_storage_tier.ssd.free_bytes,gauge,15,,,Free space in the SSD tier.,1,logicinsight_nutanix,cluster usage stats storage tier.ssd.free bytes,,
logicinsight.pe.cluster_usage_stats_storage_tier.ssd.pinned_bytes,gauge,15,,,Pinned storage in the SSD tier.,1,logicinsight_nutanix,cluster usage stats storage tier.ssd.pinned bytes,,
logicinsight.pe.cluster_usage_stats_storage_tier.ssd.pinned_usage_bytes,gauge,15,,,Used portion of pinned storage in the SSD tier.,1,logicinsight_nutanix,cluster usage stats storage tier.ssd.pinned usage bytes,,
logicinsight.pe.cluster_usage_stats_storage_tier.ssd.usage_bytes,gauge,15,,,Total used space in the SSD tier.,1,logicinsight_nutanix,cluster usage stats storage tier.ssd.usage bytes,,
logicinsight.pe.cluster_vcpu_ratio,gauge,15,,,Ratio of vCPUs to physical cores in the cluster.,1,logicinsight_nutanix,cluster vcpu ratio,,
logicinsight.pe.cluster_vms_total,gauge,15,,,Total number of virtual machines (VMs) in the cluster.,1,logicinsight_nutanix,cluster vms total,,
logicinsight.pe.container_advertised_capacity,gauge,15,,,Advertised logical capacity for the container.,1,logicinsight_nutanix,container advertised capacity,,
logicinsight.pe.container_compression_delay_in_secs,gauge,15,,,Delay before compression is applied in the container,-1,logicinsight_nutanix,container compression delay in secs,,
logicinsight.pe.container_compression_enabled,gauge,15,,,Indicates if compression is enabled for the container.,1,logicinsight_nutanix,container compression enabled,,
logicinsight.pe.container_enable_software_encryption,gauge,15,,,Indicates whether software-based encryption is enabled in the container.,1,logicinsight_nutanix,container enable software encryption,,
logicinsight.pe.container_erasure_code_delay_secs,gauge,15,,,Delay before erasure coding is triggered in the container,-1,logicinsight_nutanix,container erasure code delay secs,,
logicinsight.pe.container_marked_for_removal,gauge,15,,,Indicates whether the container is marked for removal.,0,logicinsight_nutanix,container marked for removal,,
logicinsight.pe.container_max_capacity,gauge,15,,,Maximum capacity limit set for the container.,1,logicinsight_nutanix,container max capacity,,
logicinsight.pe.container_nfs_whitelist_inherited,gauge,15,,,Indicates if the NFS whitelist was inherited by the container.,0,logicinsight_nutanix,container nfs whitelist inherited,,
logicinsight.pe.container_num_container_cluster,gauge,15,,,Number of containers in the cluster.,1,logicinsight_nutanix,container num container cluster,,
logicinsight.pe.container_oplog_replication_factor,gauge,15,,,Replication factor used for Oplog data within the container.,1,logicinsight_nutanix,container oplog replication factor,,
logicinsight.pe.container_replication_factor,gauge,15,,,Overall replication factor used for the container.,1,logicinsight_nutanix,container replication factor,,
logicinsight.pe.container_stats_avg_io_latency_usecs,gauge,15,,,Average I/O latency measured within the container,-1,logicinsight_nutanix,container stats avg io latency usecs,,
logicinsight.pe.container_stats_avg_read_io_latency_usecs,gauge,15,,,Average read I/O latency within the container,-1,logicinsight_nutanix,container stats avg read io latency usecs,,
logicinsight.pe.container_stats_avg_write_io_latency_usecs,gauge,15,,,Average write I/O latency within the container,-1,logicinsight_nutanix,container stats avg write io latency usecs,,
logicinsight.pe.container_stats_controller_avg_io_latency_usecs,gauge,15,,,Average I/O latency measured by the container's controller,-1,logicinsight_nutanix,container stats controller avg io latency usecs,,
logicinsight.pe.container_stats_controller_avg_read_io_latency_usecs,gauge,15,,,Average read latency from the containers controller,-1,logicinsight_nutanix,container stats controller avg read io latency usecs,,
logicinsight.pe.container_stats_controller_avg_read_io_size_kbytes,gauge,15,,,Average read I/O size from the controller,1,logicinsight_nutanix,container stats controller avg read io size kbytes,,
logicinsight.pe.container_stats_controller_avg_write_io_latency_usecs,gauge,15,,,Average write latency from the containers controller,-1,logicinsight_nutanix,container stats controller avg write io latency usecs,,
logicinsight.pe.container_stats_controller_avg_write_io_size_kbytes,gauge,15,,,Average write I/O size from the controller,1,logicinsight_nutanix,container stats controller avg write io size kbytes,,
logicinsight.pe.container_stats_controller_io_bandwidth_kBps,gauge,15,,,Total I/O bandwidth handled by the containers controller,1,logicinsight_nutanix,container stats controller io bandwidth kBps,,
logicinsight.pe.container_stats_controller_num_io,gauge,15,,,Total number of I/O operations handled by the controller.,1,logicinsight_nutanix,container stats controller num io,,
logicinsight.pe.container_stats_controller_num_iops,gauge,15,,,Total IOPS from the controller.,1,logicinsight_nutanix,container stats controller num iops,,
logicinsight.pe.container_stats_controller_num_random_io,gauge,15,,,Number of random I/O operations handled by the controller.,1,logicinsight_nutanix,container stats controller num random io,,
logicinsight.pe.container_stats_controller_num_read_io,gauge,15,,,Total read I/O operations handled by the controller.,1,logicinsight_nutanix,container stats controller num read io,,
logicinsight.pe.container_stats_controller_num_read_iops,gauge,15,,,Read IOPS handled by the controller.,1,logicinsight_nutanix,container stats controller num read iops,,
logicinsight.pe.container_stats_controller_num_seq_io,gauge,15,,,Total sequential I/O operations handled by the controller.,1,logicinsight_nutanix,container stats controller num seq io,,
logicinsight.pe.container_stats_controller_num_write_io,gauge,15,,,Total write I/O operations handled by the controller.,1,logicinsight_nutanix,container stats controller num write io,,
logicinsight.pe.container_stats_controller_num_write_iops,gauge,15,,,Write IOPS handled by the controller.,0,logicinsight_nutanix,container stats controller num write iops,,
logicinsight.pe.container_stats_controller_random_io_ppm,gauge,15,,,Percentage of random I/O operations measured in ppm.,0,logicinsight_nutanix,container stats controller random io ppm,,
logicinsight.pe.container_stats_controller_read_io_bandwidth_kBps,gauge,15,,,Read bandwidth measured at the controller level,1,logicinsight_nutanix,container stats controller read io bandwidth kBps,,
logicinsight.pe.container_stats_controller_read_io_ppm,gauge,15,,,Percentage of read operations measured in ppm.,0,logicinsight_nutanix,container stats controller read io ppm,,
logicinsight.pe.container_stats_controller_seq_io_ppm,gauge,15,,,Percentage of sequential operations measured in ppm.,0,logicinsight_nutanix,container stats controller seq io ppm,,
logicinsight.pe.container_stats_controller_timespan_usecs,gauge,15,,,Time window over which container controller metrics were collected,1,logicinsight_nutanix,container stats controller timespan usecs,,
logicinsight.pe.container_stats_controller_total_io_size_kbytes,gauge,15,,,Total I/O size processed by the controller,1,logicinsight_nutanix,container stats controller total io size kbytes,,
logicinsight.pe.container_stats_controller_total_io_time_usecs,gauge,15,,,Total time spent processing I/O at the controller level,1,logicinsight_nutanix,container stats controller total io time usecs,,
logicinsight.pe.container_stats_controller_total_read_io_size_kbytes,gauge,15,,,Total size of read I/O operations from the controller,1,logicinsight_nutanix,container stats controller total read io size kbytes,,
logicinsight.pe.container_stats_controller_total_read_io_time_usecs,gauge,15,,,Total time spent on read operations at the controller level,1,logicinsight_nutanix,container stats controller total read io time usecs,,
logicinsight.pe.container_stats_controller_total_transformed_usage_bytes,gauge,15,,,Total space used for transformed (compressed/deduplicated) data in the controller.,0,logicinsight_nutanix,container stats controller total transformed usage bytes,,
logicinsight.pe.container_stats_controller_write_io_bandwidth_kBps,gauge,15,,,Write I/O bandwidth measured by the controller,1,logicinsight_nutanix,container stats controller write io bandwidth kBps,,
logicinsight.pe.container_stats_controller_write_io_ppm,gauge,15,,,Percentage of write operations handled by the controller,1,logicinsight_nutanix,container stats controller write io ppm,,
logicinsight.pe.container_stats_hypervisor_avg_io_latency_usecs,gauge,15,,,Average I/O latency at the container's hypervisor level,-1,logicinsight_nutanix,container stats hypervisor avg io latency usecs,,
logicinsight.pe.container_stats_hypervisor_avg_read_io_latency_usecs,gauge,15,,,Average read I/O latency at the hypervisor level,-1,logicinsight_nutanix,container stats hypervisor avg read io latency usecs,,
logicinsight.pe.container_stats_hypervisor_avg_write_io_latency_usecs,gauge,15,,,Average write I/O latency at the hypervisor level,-1,logicinsight_nutanix,container stats hypervisor avg write io latency usecs,,
logicinsight.pe.container_stats_hypervisor_io_bandwidth_kBps,gauge,15,,,Total I/O bandwidth measured by the hypervisor,1,logicinsight_nutanix,container stats hypervisor io bandwidth kBps,,
logicinsight.pe.container_stats_hypervisor_num_io,gauge,15,,,Total number of I/O operations handled by the hypervisor.,0,logicinsight_nutanix,container stats hypervisor num io,,
logicinsight.pe.container_stats_hypervisor_num_iops,gauge,15,,,Total IOPS from the hypervisor.,0,logicinsight_nutanix,container stats hypervisor num iops,,
logicinsight.pe.container_stats_hypervisor_num_read_io,gauge,15,,,Total number of read I/O operations from the hypervisor.,1,logicinsight_nutanix,container stats hypervisor num read io,,
logicinsight.pe.container_stats_hypervisor_num_read_iops,gauge,15,,,Read IOPS measured at the hypervisor level.,0,logicinsight_nutanix,container stats hypervisor num read iops,,
logicinsight.pe.container_stats_hypervisor_num_write_io,gauge,15,,,Total number of write I/O operations from the hypervisor.,0,logicinsight_nutanix,container stats hypervisor num write io,,
logicinsight.pe.container_stats_hypervisor_num_write_iops,gauge,15,,,Write IOPS measured at the hypervisor level.,0,logicinsight_nutanix,container stats hypervisor num write iops,,
logicinsight.pe.container_stats_hypervisor_read_io_bandwidth_kBps,gauge,15,,,Read I/O bandwidth at the hypervisor level,1,logicinsight_nutanix,container stats hypervisor read io bandwidth kBps,,
logicinsight.pe.container_stats_hypervisor_timespan_usecs,gauge,15,,,Time window over which hypervisor metrics for the container were collected,1,logicinsight_nutanix,container stats hypervisor timespan usecs,,
logicinsight.pe.container_stats_hypervisor_total_io_size_kbytes,gauge,15,,,Total amount of I/O data processed by the hypervisor for a container,1,logicinsight_nutanix,container stats hypervisor total io size kbytes,,
logicinsight.pe.container_stats_hypervisor_total_io_time_usecs,gauge,15,,,Total time taken by the hypervisor to process all I/O operations for a container,1,logicinsight_nutanix,container stats hypervisor total io time usecs,,
logicinsight.pe.container_stats_hypervisor_total_read_io_size_kbytes,gauge,15,,,Total read I/O size handled by the hypervisor in kibibytes for a container,0,logicinsight_nutanix,container stats hypervisor total read io size kbytes,,
logicinsight.pe.container_stats_hypervisor_total_read_io_time_usecs,gauge,15,,,Total time spent reading I/O at the hypervisor level,0,logicinsight_nutanix,container stats hypervisor total read io time usecs,,
logicinsight.pe.container_stats_hypervisor_write_io_bandwidth_kBps,gauge,15,,,Write bandwidth from the hypervisor layer,1,logicinsight_nutanix,container stats hypervisor write io bandwidth kBps,,
logicinsight.pe.container_stats_io_bandwidth_kBps,gauge,15,,,Total I/O bandwidth observed in the container,1,logicinsight_nutanix,container stats io bandwidth kBps,,
logicinsight.pe.container_stats_num_io,gauge,15,,,Total number of I/O operations performed at the container level,0,logicinsight_nutanix,container stats num io,,
logicinsight.pe.container_stats_num_iops,gauge,15,,,Number of I/O operations per second (IOPS) for the container,0,logicinsight_nutanix,container stats num iops,,
logicinsight.pe.container_stats_num_random_io,gauge,15,,,Number of random I/O operations performed in the container,0,logicinsight_nutanix,container stats num random io,,
logicinsight.pe.container_stats_num_read_io,gauge,15,,,Number of read operations at the container level,0,logicinsight_nutanix,container stats num read io,,
logicinsight.pe.container_stats_num_read_iops,gauge,15,,,Number of read IOPS (input/output operations per second) at the container level,0,logicinsight_nutanix,container stats num read iops,,
logicinsight.pe.container_stats_num_seq_io,gauge,15,,,Number of sequential I/O operations at the container level,0,logicinsight_nutanix,container stats num seq io,,
logicinsight.pe.container_stats_num_write_io,gauge,15,,,Number of write operations at the container level,0,logicinsight_nutanix,container stats num write io,,
logicinsight.pe.container_stats_num_write_iops,gauge,15,,,Number of write IOPS at the container level,0,logicinsight_nutanix,container stats num write iops,,
logicinsight.pe.container_stats_random_io_ppm,gauge,15,,,Random I/O operations as parts per million of total I/O activity,0,logicinsight_nutanix,container stats random io ppm,,
logicinsight.pe.container_stats_read_io_bandwidth_kBps,gauge,15,,,Read I/O bandwidth from the container,0,logicinsight_nutanix,container stats read io bandwidth kBps,,
logicinsight.pe.container_stats_read_io_ppm,gauge,15,,,Read I/O as a percentage of total I/O,0,logicinsight_nutanix,container stats read io ppm,,
logicinsight.pe.container_stats_seq_io_ppm,gauge,15,,,Sequential I/O as a percentage of total I/O,0,logicinsight_nutanix,container stats seq io ppm,,
logicinsight.pe.container_stats_timespan_usecs,gauge,15,,,Duration over which the container I/O statistics were measured,0,logicinsight_nutanix,container stats timespan usecs,,
logicinsight.pe.container_stats_total_io_size_kbytes,gauge,15,,,Total size of I/O operations at the container level,1,logicinsight_nutanix,container stats total io size kbytes,,
logicinsight.pe.container_stats_total_io_time_usecs,gauge,15,,,Total time of all I/O operations at the container level,1,logicinsight_nutanix,container stats total io time usecs,,
logicinsight.pe.container_stats_total_read_io_size_kbytes,gauge,15,,,Total size of read I/O operations for the container,0,logicinsight_nutanix,container stats total read io size kbytes,,
logicinsight.pe.container_stats_total_read_io_time_usecs,gauge,15,,,Total time spent performing read I/O for the container,0,logicinsight_nutanix,container stats total read io time usecs,,
logicinsight.pe.container_stats_total_transformed_usage_bytes,gauge,15,,,Size of transformed storage in the container,0,logicinsight_nutanix,container stats total transformed usage bytes,,
logicinsight.pe.container_stats_total_untransformed_usage_bytes,gauge,15,,,Size of untransformed (raw) storage in the container,0,logicinsight_nutanix,container stats total untransformed usage bytes,,
logicinsight.pe.container_stats_write_io_bandwidth_kBps,gauge,15,,,Write bandwidth for the container,1,logicinsight_nutanix,container stats write io bandwidth kBps,,
logicinsight.pe.container_stats_write_io_ppm,gauge,15,,,Write I/O operations as a percentage of total I/O,1,logicinsight_nutanix,container stats write io ppm,,
logicinsight.pe.container_total_explicit_reserved_capacity,gauge,15,,,Explicitly reserved capacity in the container,0,logicinsight_nutanix,container total explicit reserved capacity,,
logicinsight.pe.container_total_implicit_reserved_capacity,gauge,15,,,Implicitly reserved capacity in the container,0,logicinsight_nutanix,container total implicit reserved capacity,,
logicinsight.pe.container_usage_stats_data_reduction.clone.saving_ratio_ppm,gauge,15,,,Clone space savings ratio in ppm,1,logicinsight_nutanix,container usage stats data reduction.clone.saving ratio ppm,,
logicinsight.pe.container_usage_stats_data_reduction.clone.user_saved_bytes,gauge,15,,,Bytes saved by clone data reduction,1,logicinsight_nutanix,container usage stats data reduction.clone.user saved bytes,,
logicinsight.pe.container_usage_stats_data_reduction.compression.post_reduction_bytes,gauge,15,,,Bytes reduced after compression,1,logicinsight_nutanix,container usage stats data reduction.compression.post reduction bytes,,
logicinsight.pe.container_usage_stats_data_reduction.compression.pre_reduction_bytes,gauge,15,,,Bytes before compression,1,logicinsight_nutanix,container usage stats data reduction.compression.pre reduction bytes,,
logicinsight.pe.container_usage_stats_data_reduction.compression.saving_ratio_ppm,gauge,15,,,Compression savings ratio in ppm,1,logicinsight_nutanix,container usage stats data reduction.compression.saving ratio ppm,,
logicinsight.pe.container_usage_stats_data_reduction.compression.user_post_reduction_bytes,gauge,15,,,User-side bytes reduced after compression,1,logicinsight_nutanix,container usage stats data reduction.compression.user post reduction bytes,,
logicinsight.pe.container_usage_stats_data_reduction.compression.user_pre_reduction_bytes,gauge,15,,,User-side bytes before compression,1,logicinsight_nutanix,container usage stats data reduction.compression.user pre reduction bytes,,
logicinsight.pe.container_usage_stats_data_reduction.compression.user_saved_bytes,gauge,15,,,User-side bytes saved by compression,1,logicinsight_nutanix,container usage stats data reduction.compression.user saved bytes,,
logicinsight.pe.container_usage_stats_data_reduction.dedup.post_reduction_bytes,gauge,15,,,Bytes reduced after deduplication,1,logicinsight_nutanix,container usage stats data reduction.dedup.post reduction bytes,,
logicinsight.pe.container_usage_stats_data_reduction.dedup.pre_reduction_bytes,gauge,15,,,Bytes before deduplication,1,logicinsight_nutanix,container usage stats data reduction.dedup.pre reduction bytes,,
logicinsight.pe.container_usage_stats_data_reduction.dedup.saving_ratio_ppm,gauge,15,,,Deduplication savings ratio in ppm,1,logicinsight_nutanix,container usage stats data reduction.dedup.saving ratio ppm,,
logicinsight.pe.container_usage_stats_data_reduction.dedup.user_saved_bytes,gauge,15,,,User-side bytes saved by deduplication,1,logicinsight_nutanix,container usage stats data reduction.dedup.user saved bytes,,
logicinsight.pe.container_usage_stats_data_reduction.erasure_coding.parity_bytes,gauge,15,,,Erasure coding parity bytes,1,logicinsight_nutanix,container usage stats data reduction.erasure coding.parity bytes,,
logicinsight.pe.container_usage_stats_data_reduction.erasure_coding.post_reduction_bytes,gauge,15,,,Bytes reduced after erasure coding,1,logicinsight_nutanix,container usage stats data reduction.erasure coding.post reduction bytes,,
logicinsight.pe.container_usage_stats_data_reduction.erasure_coding.potential_savings_pct,gauge,15,,,Estimated percentage of potential savings via erasure coding,1,logicinsight_nutanix,container usage stats data reduction.erasure coding.potential savings ,,
logicinsight.pe.container_usage_stats_data_reduction.erasure_coding.pre_reduction_bytes,gauge,15,,,Bytes before erasure coding,1,logicinsight_nutanix,container usage stats data reduction.erasure coding.pre reduction bytes,,
logicinsight.pe.container_usage_stats_data_reduction.erasure_coding.saving_ratio_ppm,gauge,15,,,Erasure coding savings ratio in ppm,1,logicinsight_nutanix,container usage stats data reduction.erasure coding.saving ratio ppm,,
logicinsight.pe.container_usage_stats_data_reduction.erasure_coding.user_post_reduction_bytes,gauge,15,,,User-side bytes reduced after erasure coding,1,logicinsight_nutanix,container usage stats data reduction.erasure coding.user post reduction bytes,,
logicinsight.pe.container_usage_stats_data_reduction.erasure_coding.user_pre_reduction_bytes,gauge,15,,,User-side bytes before erasure coding,1,logicinsight_nutanix,container usage stats data reduction.erasure coding.user pre reduction bytes,,
logicinsight.pe.container_usage_stats_data_reduction.erasure_coding.user_saved_bytes,gauge,15,,,User-side bytes saved by erasure coding,1,logicinsight_nutanix,container usage stats data reduction.erasure coding.user saved bytes,,
logicinsight.pe.container_usage_stats_data_reduction.overall.saving_ratio_ppm,gauge,15,,,Overall data reduction savings ratio in ppm,1,logicinsight_nutanix,container usage stats data reduction.overall.saving ratio ppm,,
logicinsight.pe.container_usage_stats_data_reduction.overall.user_saved_bytes,gauge,15,,,Overall user-side bytes saved,1,logicinsight_nutanix,container usage stats data reduction.overall.user saved bytes,,
logicinsight.pe.container_usage_stats_data_reduction.post_reduction_bytes,gauge,15,,,Total post-reduction bytes,1,logicinsight_nutanix,container usage stats data reduction.post reduction bytes,,
logicinsight.pe.container_usage_stats_data_reduction.pre_reduction_bytes,gauge,15,,,Total pre-reduction bytes,1,logicinsight_nutanix,container usage stats data reduction.pre reduction bytes,,
logicinsight.pe.container_usage_stats_data_reduction.saved_bytes,gauge,15,,,Total saved bytes,1,logicinsight_nutanix,container usage stats data reduction.saved bytes,,
logicinsight.pe.container_usage_stats_data_reduction.saving_ratio_ppm,gauge,15,,,Overall data reduction savings ratio in ppm,1,logicinsight_nutanix,container usage stats data reduction.saving ratio ppm,,
logicinsight.pe.container_usage_stats_data_reduction.thin_provision.saving_ratio_ppm,gauge,15,,,Thin provisioning savings ratio in ppm,1,logicinsight_nutanix,container usage stats data reduction.thin provision.saving ratio ppm,,
logicinsight.pe.container_usage_stats_data_reduction.thin_provision.user_saved_bytes,gauge,15,,,User-side bytes saved by thin provisioning,1,logicinsight_nutanix,container usage stats data reduction.thin provision.user saved bytes,,
logicinsight.pe.container_usage_stats_data_reduction.user_post_reduction_bytes,gauge,15,,,User-side bytes reduced after any data reduction,1,logicinsight_nutanix,container usage stats data reduction.user post reduction bytes,,
logicinsight.pe.container_usage_stats_data_reduction.user_pre_reduction_bytes,gauge,15,,,User-side bytes before any data reduction,1,logicinsight_nutanix,container usage stats data reduction.user pre reduction bytes,,
logicinsight.pe.container_usage_stats_data_reduction.user_saved_bytes,gauge,15,,,Total user-side saved bytes,1,logicinsight_nutanix,container usage stats data reduction.user saved bytes,,
logicinsight.pe.container_usage_stats_storage.capacity_bytes,gauge,15,,,Total storage capacity in the container,0,logicinsight_nutanix,container usage stats storage.capacity bytes,,
logicinsight.pe.container_usage_stats_storage.container_reserved_capacity_bytes,gauge,15,,,Reserved container capacity in bytes,0,logicinsight_nutanix,container usage stats storage.container reserved capacity bytes,,
logicinsight.pe.container_usage_stats_storage.disk_physical_usage_bytes,gauge,15,,,Physical usage of disks in bytes,0,logicinsight_nutanix,container usage stats storage.disk physical usage bytes,,
logicinsight.pe.container_usage_stats_storage.free_bytes,gauge,15,,,Free bytes available in the container,1,logicinsight_nutanix,container usage stats storage.free bytes,,
logicinsight.pe.container_usage_stats_storage.logical_snapshot_usage_bytes,gauge,15,,,Logical snapshot usage in bytes,0,logicinsight_nutanix,container usage stats storage.logical snapshot usage bytes,,
logicinsight.pe.container_usage_stats_storage.logical_usage_bytes,gauge,15,,,Logical usage in bytes,0,logicinsight_nutanix,container usage stats storage.logical usage bytes,,
